{
  "fixture_id": "child_timeout_blocks",
  "fixture_name": "Child timeout blocks",
  "category": "child-validator-failures",
  "category_class": "ESSENTIAL",
  "gap_id": "child_failure_propagation",
  "gap_status": "OPEN",
  "input_mode": "dispatcher_cli_with_mock_child",
  "dispatcher_command": "python3 scripts/agentos-validate.py --child-validator fixtures/m74-dispatcher-regression/mock-child-validators/timeout-child",
  "mock_child_behavior": "timeout",
  "mock_child_path": "fixtures/m74-dispatcher-regression/mock-child-validators/timeout-child",
  "expected_dispatcher_result": "DISPATCHER_BLOCKED",
  "expected_exit_code": 1,
  "expected_stdout_contains": ["blocked", "timeout"],
  "expected_stderr_contains": [],
  "must_not_contain": ["Overall result: PASS"],
  "expected_report_fields": {},
  "approval_created_expected": false,
  "lifecycle_mutation_expected": false,
  "m74_scope": "child-validator-failure-regression-fixtures"
}
