{
  "fixture_id": "pass_with_warnings_exit_0_visible_report",
  "fixture_name": "PASS_WITH_WARNINGS exit 0 visible in report",
  "category": "warning-visibility",
  "category_class": "ESSENTIAL",
  "gap_id": "warning_visibility",
  "gap_status": "OPEN",
  "input_mode": "dispatcher_cli_with_mock_child",
  "dispatcher_command": "python3 scripts/agentos-validate.py --child-validator fixtures/m74-dispatcher-regression/mock-child-validators/warning-child",
  "mock_child_behavior": "pass_with_warnings",
  "mock_child_path": "fixtures/m74-dispatcher-regression/mock-child-validators/warning-child",
  "expected_dispatcher_result": "DISPATCHER_PASS_WITH_WARNINGS",
  "expected_exit_code": 0,
  "expected_stdout_contains": [],
  "expected_stderr_contains": [],
  "must_not_contain": [],
  "expected_report_fields": {
    "warnings_exist": "warning"
  },
  "approval_created_expected": false,
  "lifecycle_mutation_expected": false,
  "m74_scope": "warning-visibility-regression-fixtures"
}
